{
  "$schema": "./model-protocol-profiles.schema.json",
  "schemaVersion": "model-protocol-profiles/v1",
  "registryVersion": "bailian-model-protocol-registry/v1",
  "checkedAt": "2026-08-30",
  "endpointHostPolicies": [
    {
      "region": "cn-beijing",
      "allowedHostFamilies": [
        {
          "hostFamilyId": "dashscope-cn-beijing-generic",
          "hostPattern": "dashscope.aliyuncs.com",
          "workspaceScoped": false
        },
        {
          "hostFamilyId": "maas-cn-beijing-workspace",
          "hostPattern": "*.cn-beijing.maas.aliyuncs.com",
          "workspaceScoped": true
        }
      ],
      "sources": [
        {
          "url": "https://help.aliyun.com/zh/model-studio/regions/",
          "checkedAt": "2026-08-30"
        }
      ]
    },
    {
      "region": "ap-southeast-1",
      "allowedHostFamilies": [
        {
          "hostFamilyId": "dashscope-ap-southeast-1-generic",
          "hostPattern": "dashscope-intl.aliyuncs.com",
          "workspaceScoped": false
        },
        {
          "hostFamilyId": "maas-ap-southeast-1-workspace",
          "hostPattern": "*.ap-southeast-1.maas.aliyuncs.com",
          "workspaceScoped": true
        }
      ],
      "sources": [
        {
          "url": "https://help.aliyun.com/zh/model-studio/regions/",
          "checkedAt": "2026-08-30"
        }
      ]
    }
  ],
  "dialects": [
    {
      "dialectId": "bailian-livetranslate-session-ws-v1",
      "dialectVersion": 1,
      "transport": "websocket",
      "endpointFamily": "dashscope-realtime-v1",
      "endpointPath": "/api-ws/v1/realtime",
      "modelPlacement": "query",
      "inputFraming": "json-base64",
      "outputFraming": "json-base64",
      "handshake": [
        "session.created",
        "session.update",
        "session.updated"
      ],
      "turnControl": "server-vad or manual input_audio_buffer.commit; commit itself triggers translation",
      "previewSemantics": "replaceable-snapshot",
      "textEventSemantics": [
        {
          "eventType": "conversation.item.input_audio_transcription.text",
          "updateMode": "replaceable-snapshot",
          "identityKeys": [
            "item_id",
            "content_index"
          ],
          "previewFields": [
            "text",
            "stash"
          ],
          "finalEventType": "conversation.item.input_audio_transcription.completed"
        },
        {
          "eventType": "response.text.text",
          "updateMode": "replaceable-snapshot",
          "identityKeys": [
            "response_id",
            "item_id",
            "output_index",
            "content_index"
          ],
          "previewFields": [
            "text",
            "stash"
          ],
          "finalEventType": "response.text.done"
        },
        {
          "eventType": "response.audio_transcript.text",
          "updateMode": "replaceable-snapshot",
          "identityKeys": [
            "response_id",
            "item_id",
            "output_index",
            "content_index"
          ],
          "previewFields": [
            "text",
            "stash"
          ],
          "finalEventType": "response.audio_transcript.done"
        }
      ],
      "commitSemantics": "response.text.done or response.audio_transcript.done commits translated text",
      "responseTrigger": "server-vad or input_audio_buffer.commit; response.create is forbidden",
      "terminalLifecycle": "session.finish->session.finished",
      "reusePolicy": "single-session",
      "regionPolicy": "region-key-endpoint-model-must-match",
      "audioInput": {
        "required": true,
        "codecs": [
          "pcm16",
          "opus"
        ],
        "sampleRatesHz": [
          8000,
          16000
        ],
        "channels": [
          1
        ]
      },
      "audioOutput": {
        "required": false,
        "codecs": [
          "pcm16"
        ],
        "sampleRatesHz": [
          24000
        ],
        "channels": [
          1
        ]
      },
      "clientEventTypes": [
        "session.update",
        "input_audio_buffer.append",
        "input_audio_buffer.commit",
        "input_audio_buffer.clear",
        "input_image_buffer.append",
        "session.finish"
      ],
      "serverEventTypes": [
        "session.created",
        "session.updated",
        "input_audio_buffer.speech_started",
        "input_audio_buffer.speech_stopped",
        "input_audio_buffer.committed",
        "input_audio_buffer.cleared",
        "conversation.item.created",
        "conversation.item.input_audio_transcription.text",
        "conversation.item.input_audio_transcription.completed",
        "conversation.item.input_audio_transcription.failed",
        "response.created",
        "response.text.text",
        "response.text.done",
        "response.audio_transcript.text",
        "response.audio_transcript.done",
        "response.audio.delta",
        "response.audio.done",
        "response.output_item.added",
        "response.output_item.done",
        "response.content_part.added",
        "response.content_part.done",
        "response.done",
        "session.finished",
        "error"
      ],
      "clientJsonBase64EventTypes": [
        "input_audio_buffer.append",
        "input_image_buffer.append"
      ],
      "clientBinaryEventTypes": [],
      "serverJsonBase64EventTypes": [
        "response.audio.delta"
      ],
      "serverBinaryEventTypes": [],
      "forbiddenClientEventTypes": [
        "conversation.item.create",
        "response.create",
        "finish-task"
      ],
      "forbiddenServerEventTypes": [
        "response.text.delta",
        "task-started",
        "task-finished"
      ],
      "wireFixture": "apps/desktop/src-tauri/fixtures/model-protocol/livetranslate-session.json",
      "sources": [
        {
          "url": "https://help.aliyun.com/zh/model-studio/qwen3-5-livetranslate-flash-realtime",
          "checkedAt": "2026-08-30"
        },
        {
          "url": "https://help.aliyun.com/zh/model-studio/live-translator-client-events",
          "checkedAt": "2026-08-30"
        },
        {
          "url": "https://help.aliyun.com/zh/model-studio/live-translator-server-events",
          "checkedAt": "2026-08-30"
        }
      ]
    },
    {
      "dialectId": "bailian-omni-realtime-ws-v1",
      "dialectVersion": 1,
      "transport": "websocket",
      "endpointFamily": "dashscope-realtime-v1",
      "endpointPath": "/api-ws/v1/realtime",
      "modelPlacement": "query",
      "inputFraming": "json-base64",
      "outputFraming": "json-base64",
      "handshake": [
        "session.created",
        "session.update",
        "session.updated"
      ],
      "turnControl": "server-vad or manual input_audio_buffer.commit followed by response.create",
      "previewSemantics": "mixed-by-event",
      "textEventSemantics": [
        {
          "eventType": "conversation.item.input_audio_transcription.delta",
          "updateMode": "replaceable-snapshot",
          "identityKeys": [
            "item_id",
            "content_index"
          ],
          "previewFields": [
            "text",
            "stash"
          ],
          "finalEventType": "conversation.item.input_audio_transcription.completed"
        },
        {
          "eventType": "response.text.delta",
          "updateMode": "append-delta",
          "identityKeys": [
            "response_id",
            "item_id",
            "output_index",
            "content_index"
          ],
          "previewFields": [
            "delta"
          ],
          "finalEventType": "response.text.done"
        },
        {
          "eventType": "response.audio_transcript.delta",
          "updateMode": "append-delta",
          "identityKeys": [
            "response_id",
            "item_id",
            "output_index",
            "content_index"
          ],
          "previewFields": [
            "delta"
          ],
          "finalEventType": "response.audio_transcript.done"
        },
        {
          "eventType": "response.function_call_arguments.delta",
          "updateMode": "append-delta",
          "identityKeys": [
            "response_id",
            "item_id",
            "output_index",
            "call_id"
          ],
          "previewFields": [
            "delta"
          ],
          "finalEventType": "response.function_call_arguments.done"
        }
      ],
      "commitSemantics": "response content done events commit one response; response.done is not a session terminal",
      "responseTrigger": "response.create for manual turns",
      "terminalLifecycle": "owner-close-after-response-drain",
      "reusePolicy": "multi-turn-session",
      "regionPolicy": "region-key-endpoint-model-must-match",
      "audioInput": {
        "required": false,
        "codecs": [
          "pcm16"
        ],
        "sampleRatesHz": [
          16000
        ],
        "channels": [
          1
        ]
      },
      "audioOutput": {
        "required": false,
        "codecs": [
          "pcm16"
        ],
        "sampleRatesHz": [
          24000
        ],
        "channels": [
          1
        ]
      },
      "clientEventTypes": [
        "session.update",
        "input_audio_buffer.append",
        "input_audio_buffer.commit",
        "input_audio_buffer.clear",
        "input_image_buffer.append",
        "conversation.item.create",
        "response.create",
        "response.cancel"
      ],
      "serverEventTypes": [
        "session.created",
        "session.updated",
        "input_audio_buffer.speech_started",
        "input_audio_buffer.speech_stopped",
        "input_audio_buffer.committed",
        "input_audio_buffer.cleared",
        "conversation.item.created",
        "conversation.item.input_audio_transcription.delta",
        "conversation.item.input_audio_transcription.completed",